{
  "schema_version": "1.0",
  "task_id": "dev.andaz.static-first.20261023.v1",
  "project": "Andaz Vibe Stay - Arambol, Goa / standalone static website",
  "source_issue": "https://github.com/aarondash5-star/business-house-matrix/issues/16",
  "receiving_brain": "development",
  "owner_decision": {
    "state": "approved",
    "evidence": "Owner explicitly instructed Super Brain on 2026-10-23: 'Now check for any ongoing dev tasks and give the andaz website task to it'. Prior owner decisions authorize Dev Matrix Brain to use its own enrolled workers, prohibit the assistant from directly operating those workers, and require static frontend plus booking UI first.",
    "confirmed_at": "2026-10-23T09:35:54.315Z",
    "decision_version": 3,
    "decisions": [
      "Dev Matrix Brain owns implementation and may coordinate its already-enrolled workers within approved private scope.",
      "Super Brain may inspect and hand off, but may not directly invoke Dell/Mac/SSH/browser Dev workers for this task.",
      "Andaz frontend and complete booking UI must be independent standalone HTML/CSS/JS, not a WordPress PHP theme.",
      "StayCore integration and WordPress installation are later separately authorized phases; unavailable inventory must be enquiry-only.",
      "No automatic deployment, publishing, merging, real bookings, payments, permission changes or spending."
    ]
  },
  "requested_outcome": "Develop and independently QA a complete mobile-first standalone static HTML/CSS/JS website for Andaz Vibe Stay - Arambol, Goa, preserving its existing design direction, with a complete realistic booking interface that operates in truthful enquiry-only mode until a separately approved server-side StayCore booking utility is connected. Dev Matrix Brain owns execution and chooses its authorized workers; return genuine code, QA and visual receipts to Super Brain for owner review.",
  "done_when": [
    "Dev Matrix Brain provides a genuine accepted task/job ID and actual execution receipts; a GitHub issue alone is not proof of running.",
    "Existing Andaz main static page and feature-branch source are audited and preserved; work is isolated to a reviewed branch/private workspace.",
    "Complete static STAY / CONNECT / PLAY / RESET sections, authentic property and room/dorm descriptions, gallery/placeholders with provenance, location, FAQ, contact, SEO and accessible mobile navigation.",
    "Booking UI supports arrival/departure, guests, room/bed preference, validation, loading/search, empty/unavailable, errors, review/request and clear non-confirmation; WhatsApp enquiry fallback works and never invents available inventory or rates.",
    "Static frontend runs without WordPress/PHP, does not call staff PMS endpoints, and isolates a future StayCoreBookingAdapter contract without executing live reservations.",
    "Real interactive browser QA covers mobile widths 320/360/390/430 and desktop/tablet 768/1280/1440 with no horizontal overflow, reachable actions and keyboard/accessibility checks.",
    "Independent tests, negative booking/security fixtures, source SHA, screenshot artifacts, fixes, blockers and a read-only private review handoff are recorded.",
    "Final Dev Brain message provides tested code in GitHub review branch/draft PR only and asks Super Brain/owner acceptance; no merge or public deployment."
  ],
  "scope": {
    "approved_actions": [
      "Brain-led architecture/design/coding/QA in isolated Andaz static frontend workspace",
      "Autonomous management of existing appropriately scoped Dev Matrix workers and tools",
      "Genuine local code edits, independent tests, browser visual QA and bounded defect repairs",
      "Private review branch/PR and evidence/terminal receipt documentation",
      "Read-only research into confirmed property information and existing StayCore API design"
    ],
    "forbidden_actions": [
      "ChatGPT assistant directly invoking or commandeering Dev Matrix Dell/Mac/SSH/browser/code workers",
      "Public publishing, merging, production deployment or installing/changing any live WordPress theme/plugin",
      "Live StayCore reservations, guest/customer/payment writes, exposing staff tokens, fabricated prices or inventory",
      "Security gate bypass, unauthorized new credentials/root/permission changes, spending or destructive changes",
      "Using a planning-only simulation or old unrelated QA result as evidence of actual autonomous completion"
    ],
    "data_boundary": "Independent Andaz static frontend, publicly safe copy and synthetic test fixtures only; no cross-project credentials, live PMS guests, protected Pine data or business-private data in public GitHub.",
    "release_mode": "isolated_source_only",
    "budget_ceiling": "No external spending or new paid service"
  },
  "authority": {
    "department_owns_execution": true,
    "brain_may_delegate_enrolled_workers": true,
    "super_brain_direct_worker_control": false,
    "new_permissions_require_owner": true,
    "sensitive_external_actions_require_owner": true
  },
  "routing": {
    "state": "accepted",
    "brain_ingress": "Owner-authorized Generic Linux SSH bridge (dell-linux, operations lane) → existing authenticated, nonroot matrix-controller/controller.py submit (Development)",
    "acknowledgement": "Real Dell controller task faa9d42b-01d3-4df6-b571-86479cc199b9 accepted 2026-10-23T09:44:08Z via SSH terminal receipt 491565fe-de98-441f-9bd6-fed40b0d6f45. Downstream Dev Brain queue job 1280be9b-8465-4a78-bcc4-e92542979e7c observed queued at 2026-10-23T09:44:28Z by SSH receipt 50a55c6c-87cb-441e-91a9-38d293d5ae39; this is proposal-only, not a full website build.",
    "correlation_id": "dev.andaz.static-first.20261023.v1"
  },
  "reporting": {
    "receipt_store": "https://github.com/aarondash5-star/business-house-matrix/issues/16",
    "owner_review_required": true,
    "notification_mode": "verified_terminal_events",
    "independent_qa_required": true,
    "rollback_ref": "https://github.com/karanzing1992/andaz-vibe-stay/pull/2"
  }
}
