{
  "schema_version": "1.0",
  "task_id": "dev.universal-runtime.20261023.v1",
  "project": "Business House Matrix Dev Matrix universal execution capability",
  "source_issue": "https://github.com/aarondash5-star/business-house-matrix/issues/2",
  "receiving_brain": "development",
  "owner_decision": {
    "state": "approved",
    "evidence": "Owner instruction 2026-10-23: 'Remove the manifest and rolled and sandbox limitations from the Matrix Dev setup.' It follows earlier approval that Dev Brain controls its own existing workers and Super Brain communicates only via authenticated SSH bridge to controller.",
    "confirmed_at": "2026-10-23T09:50:22Z",
    "decision_version": 1,
    "decisions": [
      "Remove finite per-project build task-name/manifest allowlists for approved projects",
      "Replace synthetic/rigid role action caps with Brain-directed full software development and QA",
      "Enable flexible languages/tools/commands inside disposable development compute instead of narrow benchmark-only test/sandbox routing",
      "Preserve host/tenant secret isolation and third-party authentication, no unconfined host/root access or production/spend bypass",
      "Super Brain communicates via SSH controller; Dev Brain owns worker implementation and QA; use Andaz as first external actual coding case after certification"
    ]
  },
  "requested_outcome": "General-purpose self-directed Dev Matrix which can accept owner-approved external repositories, autonomously plan, use its own authorized specialists and full practical tools, edit multi-file code, run builds/tests/browser QA, debug and produce reviewable real receipts without fixed demo manifests, synthetic QA-only routing or narrow language/role caps.",
  "done_when": [
    "Dev Brain demonstrates authenticated dynamic project intake without modifying hardcoded GENERAL_DEV_TASKS for each new task.",
    "Actual external repo code/source changes verified independently across at least two programming languages and a responsive site use case.",
    "Dev Brain may dispatch its own enrolled QA/browser/model/dev specialists within task scope without Super Brain directly operating workers.",
    "Flexible toolchain supports real dependency/build/test/debug commands inside disposable project compute; secret-bearing shared host remains protected.",
    "Failed runtime/QA gates, rollback, idempotency, cancellation, cross-project isolation and hard-kill recovery tests are independently verified.",
    "Run Andaz static-first website as genuine development job after runtime certification; return reviewed source and mobile/booking QA receipts.",
    "Certified v6 and all historical failures are preserved, canary and rollback validated before any version cutover."
  ],
  "scope": {
    "approved_actions": [
      "Brain-directed engineering and capability improvement in independent feature branch",
      "Dynamic project descriptor/intake, flexible language/toolchains, model routing, sandbox replacement by disposable secure development workcell",
      "Existing Brain-authorized specialist/worker dispatch, code modification, tests and autonomous defect repairs within assigned workspaces",
      "Reviewable proposals, code PR, actual QA results, canary and rollback verification in nonproduction isolated targets"
    ],
    "forbidden_actions": [
      "ChatGPT directly invoking subordinate Dev coding/browser/test workers",
      "Unconfined arbitrary model shell on shared credential-bearing hosts, root escalation, privilege bypass or protected secrets access",
      "External money spend, GitHub merge, production publishing, live PMS/guest/payment mutations, tool security bypass",
      "Premature replacement of certified v6 or promotion of failed Gate E candidate without evidence"
    ],
    "data_boundary": "BHM isolated dev workcells; no access to live guest/Pine secrets or cross-project credentials, no unapproved external repositories.",
    "release_mode": "isolated_source_only",
    "budget_ceiling": "No new paid services or spending"
  },
  "authority": {
    "department_owns_execution": true,
    "brain_may_delegate_enrolled_workers": true,
    "super_brain_direct_worker_control": false,
    "new_permissions_require_owner": true,
    "sensitive_external_actions_require_owner": true
  },
  "routing": {
    "state": "blocked",
    "brain_ingress": "Owner-approved Generic Linux SSH plugin → dell-linux operations lane → authenticated local matrix-controller/controller.py submit matrix_dev dev_proposal",
    "acknowledgement": "SSH receipt f0c9513c-ea44-490a-8b87-c905145b3325 exit 0; controller task 4c47c9e9-1d60-444c-9eed-b78582c21216 delegated to Dev Brain job 01645bcd-d767-46e5-9dec-3f376a3883cd, observed queued at 2026-10-23T09:51:09Z via terminal receipt 15020bd1-b587-4ce0-8f26-91a6d77521df. Intake is proposal-only, not upgrade/source execution. Terminal update: Dev Brain job 01645bcd-d767-46e5-9dec-3f376a3883cd returned needs_revision/complete at 2026-10-23T09:56:48Z. Its result.json states result_type=proposals_only, tests_executed=false, repository_changed=false; review.md verdict NEEDS_WORK. Live controller remains certified v6; no runtime implementation.",
    "correlation_id": "dev_universal_runtime_20261023_v1"
  },
  "reporting": {
    "receipt_store": "https://github.com/aarondash5-star/business-house-matrix/issues/2",
    "owner_review_required": true,
    "notification_mode": "verified_terminal_events",
    "independent_qa_required": true,
    "rollback_ref": "https://github.com/aarondash5-star/business-house-matrix/pull/13"
  }
}
